Title,Price,Rating,Past Sale,Image URL,Specifications
"ASUS ZenBook Pro 14 14X OLED Q420 Business Laptop (14.5"" QHD+ Touchscreen, Intel 13th Gen 14-Core i7-13700H, 16GB RAM, 512GB SSD), Backlit, FHD Webcam, NumberPad, IST HDMI, Win 11 Home, Inkwell Gray",$899.98,Rating not found,Past sale not found,./Amazon_laptop_files/71fRr9Z3qfL._AC_UY218_.jpg,"ASUS ZenBook Pro 14 14X OLED Q420 Business Laptop (14.5"" QHD+ Touchscreen, Intel 13th Gen 14-Core i7-13700H, 16GB RAM, 512GB SSD), Backlit, FHD Webcam, NumberPad, IST HDMI, Win 11 Home, Inkwell Gray"
"Lenovo V15 Essential Laptop | 15.6"" FHD Anti-Glare Display | Intel Core i7-1255U Processor | 16GB RAM | 512GB SSD | HDMI | Ethernet RJ-45 | Numeric Keypad | Webcam | Wi-Fi 6 | Windows 11 Pro | Grey",Price not found,Rating not found,No featured offers available,./Amazon_laptop_files/611e47yHw4L._AC_UY218_.jpg,"Lenovo V15 Essential Laptop | 15.6"" FHD Anti-Glare Display | Intel Core i7-1255U Processor | 16GB RAM | 512GB SSD | HDMI | Ethernet RJ-45 | Numeric Keypad | Webcam | Wi-Fi 6 | Windows 11 Pro | Grey"
HP 15-dw Laptop Intel Core i3-1115G4 8GB 256GB SSD 15.6 Full HD WLED Win 10,Price not found,Rating not found,50+ bought in past month,./Amazon_laptop_files/61gpcrBxRKL._AC_UY218_.jpg,HP 15-dw Laptop Intel Core i3-1115G4 8GB 256GB SSD 15.6 Full HD WLED Win 10
"Alienware m18 AMD Gaming Laptop - 18-inch FHD+ (1920 x 1200) 480Hz 3ms Display, AMD Ryzen 9-7845HX, 32GB DDR5 RAM, 1TB SSD, NVIDIA GeForce RTX 4080 GDDR6, 1-Year Premium Support - Dark Metallic Moon",Price not found,Rating not found,No featured offers available,./Amazon_laptop_files/71ixrysoD1L._AC_UY218_.jpg,"Alienware m18 AMD Gaming Laptop - 18-inch FHD+ (1920 x 1200) 480Hz 3ms Display, AMD Ryzen 9-7845HX, 32GB DDR5 RAM, 1TB SSD, NVIDIA GeForce RTX 4080 GDDR6, 1-Year Premium Support - Dark Metallic Moon"
"ASUS TUF Gaming A15 (2023) Gaming Laptop, 15.6” FHD 144Hz Display, GeForce RTX 4070, AMD Ryzen 7 7940HS, 16GB DDR5, 1TB PCIe SSD, Wi-Fi 6, Windows 11, FA507XI-EH94(Mecha Gray)",Price not found,4.4 out of 5 stars,No featured offers available,./Amazon_laptop_files/71ZQQjrsY8L._AC_UY218_.jpg,"ASUS TUF Gaming A15 (2023) Gaming Laptop, 15.6” FHD 144Hz Display, GeForce RTX 4070, AMD Ryzen 7 7940HS, 16GB DDR5, 1TB PCIe SSD, Wi-Fi 6, Windows 11, FA507XI-EH94(Mecha Gray)"
"Apple 2023 MacBook Pro 14-inch Laptop M3 chip: 16GB Memory, 1TB Storage; Space Gray with AppleCare+ (3 Years)","$2,078.00",4.6 out of 5 stars,List:,./Amazon_laptop_files/51hAK6sqprL._AC_UY218_.jpg,"Apple 2023 MacBook Pro 14-inch Laptop M3 chip: 16GB Memory, 1TB Storage; Space Gray with AppleCare+ (3 Years)"
"HP 14 Laptop, Intel Celeron N4020, 4 GB RAM, 64 GB Storage, 14-inch Micro-edge HD Display, Windows 11 Home, Thin & Portable, 4K Graphics, One Year of Microsoft 365 (14-dq0030nr, Pale Rose Gold)",$209.49,Rating not found,50+ bought in past month,./Amazon_laptop_files/818vEGdvS+S._AC_UY218_.jpg,"HP 14 Laptop, Intel Celeron N4020, 4 GB RAM, 64 GB Storage, 14-inch Micro-edge HD Display, Windows 11 Home, Thin & Portable, 4K Graphics, One Year of Microsoft 365 (14-dq0030nr, Pale Rose Gold)"
"Dell Newest Vostro 3520 Business Laptop, 15.6"" HD Display, Intel Core i5-1135G7 Processor, 32GB DDR4 RAM, 512GB PCIe SSD, Webcam, HDMI, Wi-Fi, Windows 11 Pro, Black",Price not found,Rating not found,No featured offers available,./Amazon_laptop_files/71IpQj+PIfL._AC_UY218_.jpg,"Dell Newest Vostro 3520 Business Laptop, 15.6"" HD Display, Intel Core i5-1135G7 Processor, 32GB DDR4 RAM, 512GB PCIe SSD, Webcam, HDMI, Wi-Fi, Windows 11 Pro, Black"
"Microsoft Surface Laptop 6 13.5"" Touchscreen Notebook - Intel Core Ultra 7 165H - 32 GB - 512 GB SSD - English Keyboard - Black",Price not found,Rating not found,No featured offers available,./Amazon_laptop_files/51sZ-qxGgLL._AC_UY218_.jpg,"Microsoft Surface Laptop 6 13.5"" Touchscreen Notebook - Intel Core Ultra 7 165H - 32 GB - 512 GB SSD - English Keyboard - Black"
"Lenovo ThinkBook 15 Business Laptop (15.6"" FHD Anti-Glare, 16GB RAM, 512GB SSD, AMD Ryzen 7 5825U (> i7-1165G7)), FHD Webcam w/ Shutter, Military Grade, Fingerprint, Ethernet, Win 11 Pro, Grey, 2024",$649.98,Rating not found,Past sale not found,./Amazon_laptop_files/71muP+Lh00L._AC_UY218_.jpg,"Lenovo ThinkBook 15 Business Laptop (15.6"" FHD Anti-Glare, 16GB RAM, 512GB SSD, AMD Ryzen 7 5825U (> i7-1165G7)), FHD Webcam w/ Shutter, Military Grade, Fingerprint, Ethernet, Win 11 Pro, Grey, 2024"
"Microsoft Surface Laptop Go 3 12.4"" Touchscreen Notebook - Intel Core i5-8 GB - 128 GB SSD - English Keyboard - Platinum",Price not found,Rating not found,No featured offers available,./Amazon_laptop_files/517O9Q-KghL._AC_UY218_.jpg,"Microsoft Surface Laptop Go 3 12.4"" Touchscreen Notebook - Intel Core i5-8 GB - 128 GB SSD - English Keyboard - Platinum"
"HP 15 Laptop for Business and Home (15.6"" FHD Anti-Glare, Intel Core i5-1135G7 (Beats i7-10510U), 32GB RAM, 1TB SSD), Narrow-Bezel, Long Battery Life, Webcam, Numpad, IST SD Card, Win 11 Pro, Silver",$629.98,Rating not found,Past sale not found,./Amazon_laptop_files/71AOuo4oxoL._AC_UY218_.jpg,"HP 15 Laptop for Business and Home (15.6"" FHD Anti-Glare, Intel Core i5-1135G7 (Beats i7-10510U), 32GB RAM, 1TB SSD), Narrow-Bezel, Long Battery Life, Webcam, Numpad, IST SD Card, Win 11 Pro, Silver"
"HP 15 Laptop (15.6"" FHD Anti-glare, Intel Core i5-1135G7 (Beats i7-10510U), 16GB RAM, 512GB SSD) Home & Business PC, Narrow-Bezel, 10-Hr Long Battery Life, Type-C, Webcam, Numpad, Win 11 Home, Silver",$499.98,Rating not found,Past sale not found,./Amazon_laptop_files/61d-BxDbTpL._AC_UY218_.jpg,"HP 15 Laptop (15.6"" FHD Anti-glare, Intel Core i5-1135G7 (Beats i7-10510U), 16GB RAM, 512GB SSD) Home & Business PC, Narrow-Bezel, 10-Hr Long Battery Life, Type-C, Webcam, Numpad, Win 11 Home, Silver"
"Acer Chromebook Plus 514 Laptop with Google AI – 14"" Full HD 1920 x 1080 IPS Display | Intel Core i3-N305 | 8GB LPDDR5 | 128GB SSD | Wi-Fi 6E | FHD Camera | Chrome OS | CB514-4H-38JA",Price not found,Rating not found,50+ bought in past month,./Amazon_laptop_files/71TxZ8W9pzL._AC_UY218_.jpg,"Acer Chromebook Plus 514 Laptop with Google AI – 14"" Full HD 1920 x 1080 IPS Display | Intel Core i3-N305 | 8GB LPDDR5 | 128GB SSD | Wi-Fi 6E | FHD Camera | Chrome OS | CB514-4H-38JA"
"ASUS 2020 VivoBook 15 15.6 Inch FHD 1080P Laptop (AMD Ryzen 3 3200U up to 3.5GHz, 8GB DDR4 RAM, 256GB SSD, AMD Radeon Vega 3, Backlit Keyboard, FP Reader, WiFi, Bluetooth, HDMI, Windows 10) (Grey)",$474.88,4.3 out of 5 stars,More Buying Choices,./Amazon_laptop_files/61+5BgTuO7L._AC_UY218_.jpg,"ASUS 2020 VivoBook 15 15.6 Inch FHD 1080P Laptop (AMD Ryzen 3 3200U up to 3.5GHz, 8GB DDR4 RAM, 256GB SSD, AMD Radeon Vega 3, Backlit Keyboard, FP Reader, WiFi, Bluetooth, HDMI, Windows 10) (Grey)"
StarTech.com 8 Outlet Horizontal 1U Rack Mount PDU Power Strip for Network Server Racks - Surge Protection - 120V/15A - w/ 6ft Power Cord (RKPW081915),$62.99,Rating not found,1K+ bought in past month,./Amazon_laptop_files/614Ua++1CaL._AC_UY218_.jpg,StarTech.com 8 Outlet Horizontal 1U Rack Mount PDU Power Strip for Network Server Racks - Surge Protection - 120V/15A - w/ 6ft Power Cord (RKPW081915)
"187 Killer Pads Mesh Duffel , Black",$55.88,Rating not found,Past sale not found,./Amazon_laptop_files/71woh3HkgJL._AC_UY218_.jpg,"187 Killer Pads Mesh Duffel , Black"
Dell Latitude 5300 Laptop 13.3 - Intel Core i7 8th Gen - i7-8665U - Quad Core 4.8Ghz - 512GB SSD - 16GB RAM - 1920x1080 FHD - Windows 10 Pro (Renewed),$225.99,4.3 out of 5 stars,List Price:,./Amazon_laptop_files/61h3hFnZuGS._AC_UY218_.jpg,Dell Latitude 5300 Laptop 13.3 - Intel Core i7 8th Gen - i7-8665U - Quad Core 4.8Ghz - 512GB SSD - 16GB RAM - 1920x1080 FHD - Windows 10 Pro (Renewed)
"HP EliteBook 840 G8 Business Laptop (14"" FHD Touchscreen, Intel 4-Core i5-1145G7, 16GB RAM, 512GB PCIe SSD), 14.5-Hr Long Battery Life, Backlit Keyboard, Thunderbolt 4, 3-Year WRT, Win 11 Pro, Sliver",$699.98,4.5 out of 5 stars,Past sale not found,./Amazon_laptop_files/71jN2IWTv8L._AC_UY218_.jpg,"HP EliteBook 840 G8 Business Laptop (14"" FHD Touchscreen, Intel 4-Core i5-1145G7, 16GB RAM, 512GB PCIe SSD), 14.5-Hr Long Battery Life, Backlit Keyboard, Thunderbolt 4, 3-Year WRT, Win 11 Pro, Sliver"
"Apple 2023 MacBook Air Laptop with M2 chip: 15.3-inch Liquid Retina Display, 8GB Unified Memory, 512GB SSD Storage, 1080p FaceTime HD Camera, Touch ID. Works with iPhone/iPad; Midnight",Price not found,4.7 out of 5 stars,No featured offers available,./Amazon_laptop_files/81Fm0tRFdHL._AC_UY218_.jpg,"Apple 2023 MacBook Air Laptop with M2 chip: 15.3-inch Liquid Retina Display, 8GB Unified Memory, 512GB SSD Storage, 1080p FaceTime HD Camera, Touch ID. Works with iPhone/iPad; Midnight"
"HP 14-fq0032ms Laptop for Business and Student, 14"""" LED Touchscreen, AMD Ryzen 3 3250U Processor(up to 3.5 GHz), 8GB RAM, 128GB SSD, Webcam, WiFi, Ethernet, HDMI, USB-A&C, Win10, Natural Silver",$341.99,4.3 out of 5 stars,More Buying Choices,./Amazon_laptop_files/716CXZDcoQL._AC_UY218_.jpg,"HP 14-fq0032ms Laptop for Business and Student, 14"""" LED Touchscreen, AMD Ryzen 3 3250U Processor(up to 3.5 GHz), 8GB RAM, 128GB SSD, Webcam, WiFi, Ethernet, HDMI, USB-A&C, Win10, Natural Silver"
"ASUS ROG Strix G16 (2023) Gaming Laptop, 16” 16:10 FHD 165Hz, GeForce RTX 4070, Intel Core i9-13980HX, 16GB DDR5, 1TB PCIe SSD, Wi-Fi 6E, Windows 11, G614JI-AS94, Eclipse Gray",Price not found,4.3 out of 5 stars,No featured offers available,./Amazon_laptop_files/71v0BQo8T8L._AC_UY218_.jpg,"ASUS ROG Strix G16 (2023) Gaming Laptop, 16” 16:10 FHD 165Hz, GeForce RTX 4070, Intel Core i9-13980HX, 16GB DDR5, 1TB PCIe SSD, Wi-Fi 6E, Windows 11, G614JI-AS94, Eclipse Gray"
"Lenovo ideapad 3i Laptop, 15.6"" Full HD Touchscreen Laptop, Intel Core i7-1255U, 16GB RAM, 512GB PCIe NVMe SSD, Windows 11 Home, Grey, Alpacatec 32GB Card",$609.00,Rating not found,Past sale not found,./Amazon_laptop_files/61CUoXL8MsL._AC_UY218_.jpg,"Lenovo ideapad 3i Laptop, 15.6"" Full HD Touchscreen Laptop, Intel Core i7-1255U, 16GB RAM, 512GB PCIe NVMe SSD, Windows 11 Home, Grey, Alpacatec 32GB Card"
"Razer Blade 16 (2024) Gaming Laptop: NVIDIA GeForce RTX 4080 - Intel Core i9-14900HX 14th Gen CPU - 16"" OLED QHD+ 240Hz Display - 32GB RAM - 1TB SSD - Aluminum Unibody - Windows 11 - Chroma RGB",Price not found,Rating not found,No featured offers available,./Amazon_laptop_files/81sX1nwD+fL._AC_UY218_.jpg,"Razer Blade 16 (2024) Gaming Laptop: NVIDIA GeForce RTX 4080 - Intel Core i9-14900HX 14th Gen CPU - 16"" OLED QHD+ 240Hz Display - 32GB RAM - 1TB SSD - Aluminum Unibody - Windows 11 - Chroma RGB"
"Alienware X16 R1 Gaming Laptop - 16-inch QHD+ 240Hz Display, Intel Core i9-13900HK, 32GB LPDDR5 RAM, 1TB SSD, NVIDIA GeForce RTX 4080 12GB GDDR6, Windows 11 Home - Lunar Silver",Price not found,Rating not found,No featured offers available,./Amazon_laptop_files/71WJ2jTqZgL._AC_UY218_.jpg,"Alienware X16 R1 Gaming Laptop - 16-inch QHD+ 240Hz Display, Intel Core i9-13900HK, 32GB LPDDR5 RAM, 1TB SSD, NVIDIA GeForce RTX 4080 12GB GDDR6, Windows 11 Home - Lunar Silver"
"Lenovo ThinkPad T16 16"" i7 Business Laptop, FHD+ Display, i7-1355U, 32GB DDR5 RAM, 1TB SSD, SD Card Reader, 1 Yr Warranty, RJ-45, Wi-Fi 6, Windows 11 Pro, Black",Price not found,Rating not found,No featured offers available,./Amazon_laptop_files/710JaF3BANL._AC_UY218_.jpg,"Lenovo ThinkPad T16 16"" i7 Business Laptop, FHD+ Display, i7-1355U, 32GB DDR5 RAM, 1TB SSD, SD Card Reader, 1 Yr Warranty, RJ-45, Wi-Fi 6, Windows 11 Pro, Black"
"Dell Inspiron 16 5635 Laptop - AMD Ryzen 7-7730U, QHD 16 inch, 16GB LPDDR4x RAM, 1TB SSD, AMD Radeon Graphics, Windows 11 Home, 1 Year Premium Support - Platinum Silver",Price not found,Rating not found,No featured offers available,./Amazon_laptop_files/71OoFTrVZxL._AC_UY218_.jpg,"Dell Inspiron 16 5635 Laptop - AMD Ryzen 7-7730U, QHD 16 inch, 16GB LPDDR4x RAM, 1TB SSD, AMD Radeon Graphics, Windows 11 Home, 1 Year Premium Support - Platinum Silver"
"Latest Lenovo ThinkBook 15 Gen 4,15.6"" FHD (1920 x 1080) IPS, Anti-Glare, 12th Gen Intel i7-1255U, 512GB SSD, 16GB DDR4, Thunderbolt 4, 1080P Camera, Win 11 Pro - Mineral Grey (Authorized Reseller)",Price not found,4.5 out of 5 stars,No featured offers available,./Amazon_laptop_files/71xVkAdWeYL._AC_UY218_.jpg,"Latest Lenovo ThinkBook 15 Gen 4,15.6"" FHD (1920 x 1080) IPS, Anti-Glare, 12th Gen Intel i7-1255U, 512GB SSD, 16GB DDR4, Thunderbolt 4, 1080P Camera, Win 11 Pro - Mineral Grey (Authorized Reseller)"
"SAMSUNG 14” Galaxy Book3 Pro Laptop PC Computer, 13th Gen Intel Core i7-1360P Processor / 16GB / 512GB, 3K AMOLED Screen, 120hz, Fingerprint Reader, FHD Webcam, 2023 Model, NP940XFG-KC2US, Graphite",Price not found,4.4 out of 5 stars,No featured offers available,./Amazon_laptop_files/61oTh3Oun5L._AC_UY218_.jpg,"SAMSUNG 14” Galaxy Book3 Pro Laptop PC Computer, 13th Gen Intel Core i7-1360P Processor / 16GB / 512GB, 3K AMOLED Screen, 120hz, Fingerprint Reader, FHD Webcam, 2023 Model, NP940XFG-KC2US, Graphite"
"MNN Portable Monitor 15.6inch FHD 1080P USB C HDMI Gaming Ultra-Slim IPS Display w/Smart Cover & Speakers,HDR Plug&Play, External Monitor for Laptop PC Phone Mac",Price not found,4.5 out of 5 stars,8K+ bought in past month,./Amazon_laptop_files/81F99hab1GL._AC_UY218_.jpg,"MNN Portable Monitor 15.6inch FHD 1080P USB C HDMI Gaming Ultra-Slim IPS Display w/Smart Cover & Speakers,HDR Plug&Play, External Monitor for Laptop PC Phone Mac"
"HP Chromebook 11 G9 EE 11.6"" Touchscreen Chromebook - HD - 1366 x 768 - Intel Celeron N4500 Dual-core (2 Core) - 4 GB RAM - 32 GB Flash Memory",Price not found,Rating not found,No featured offers available,./Amazon_laptop_files/61KUIjmfe7L._AC_UY218_.jpg,"HP Chromebook 11 G9 EE 11.6"" Touchscreen Chromebook - HD - 1366 x 768 - Intel Celeron N4500 Dual-core (2 Core) - 4 GB RAM - 32 GB Flash Memory"
"2020 Apple MacBook Air Laptop: Apple M1 Chip, 13” Retina Display, 8GB RAM, 256GB SSD Storage, Backlit Keyboard, FaceTime HD Camera, Touch ID. Works with iPhone/iPad; Gold",Price not found,Rating not found,No featured offers available,./Amazon_laptop_files/71vFKBpKakL._AC_UY218_.jpg,"2020 Apple MacBook Air Laptop: Apple M1 Chip, 13” Retina Display, 8GB RAM, 256GB SSD Storage, Backlit Keyboard, FaceTime HD Camera, Touch ID. Works with iPhone/iPad; Gold"
"Morostron 13.5"" Laptop Computer, 3K Full HD IPS Screen, Windows 11 Laptop with N4120 Quad Core Processor, 8GB RAM 256GB SSD, Backlit Keyboard, Touch ID, WiFi, USB, HDMI, Bluetooth, Type-C",$179.99,Rating not found,Past sale not found,./Amazon_laptop_files/71N6Z87Z39L._AC_UY218_.jpg,"Morostron 13.5"" Laptop Computer, 3K Full HD IPS Screen, Windows 11 Laptop with N4120 Quad Core Processor, 8GB RAM 256GB SSD, Backlit Keyboard, Touch ID, WiFi, USB, HDMI, Bluetooth, Type-C"
"Dell G16 G-Series 7630 Gaming Laptop - 16-inch QHD+ 165Hz, 3ms, Intel Core i9-13900HX, 16GB DDR5 RAM, 1TB SSD, NVIDIA GeForce RTX 4070 8GB GDDR6, Windows 11 Home, Onsite Service - Metallic Nightshade",Price not found,Rating not found,No featured offers available,./Amazon_laptop_files/71+8kBgZIYL._AC_UY218_.jpg,"Dell G16 G-Series 7630 Gaming Laptop - 16-inch QHD+ 165Hz, 3ms, Intel Core i9-13900HX, 16GB DDR5 RAM, 1TB SSD, NVIDIA GeForce RTX 4070 8GB GDDR6, Windows 11 Home, Onsite Service - Metallic Nightshade"
"ASUS Vivobook Pro 16X Laptop, 16” 16:10 Display, Intel Core i9-13980HX CPU, NVIDIA® GeForce® RTX™ 4070 GPU, 32GB RAM, 1TB SSD, Windows 11 Home, Earl Grey, K6604JI-AS99",Price not found,Rating not found,No featured offers available,./Amazon_laptop_files/51TFI2uGmQL._AC_UY218_.jpg,"ASUS Vivobook Pro 16X Laptop, 16” 16:10 Display, Intel Core i9-13980HX CPU, NVIDIA® GeForce® RTX™ 4070 GPU, 32GB RAM, 1TB SSD, Windows 11 Home, Earl Grey, K6604JI-AS99"
"Lenovo Laptop V15 for Business (15.6"" FHD, AMD 6-Core Ryzen 5 5500U (Beat i7-1065G7), 16GB RAM, 1TB SSD), Webcam w/Shutter, Military Grade, Numeric Keypad, IST Cable, Ethernet, Wi-Fi, Win 11 Pro",$569.98,4.6 out of 5 stars,More Buying Choices,./Amazon_laptop_files/61MwgCZQM4L._AC_UY218_.jpg,"Lenovo Laptop V15 for Business (15.6"" FHD, AMD 6-Core Ryzen 5 5500U (Beat i7-1065G7), 16GB RAM, 1TB SSD), Webcam w/Shutter, Military Grade, Numeric Keypad, IST Cable, Ethernet, Wi-Fi, Win 11 Pro"
"HP Victus 15.6"" Full HD 144Hz Gaming Laptop | AMD Ryzen 5 7535HS | NVIDIA GeForce RTX 2050 | 16GB RAM DDR5| 512GB SSD | Backlit | Windows 11 Home | Bundle with 64GB USB Flash Drive, Mica Silver",$699.00,4.4 out of 5 stars,Past sale not found,./Amazon_laptop_files/51+jzdipHpL._AC_UY218_.jpg,"HP Victus 15.6"" Full HD 144Hz Gaming Laptop | AMD Ryzen 5 7535HS | NVIDIA GeForce RTX 2050 | 16GB RAM DDR5| 512GB SSD | Backlit | Windows 11 Home | Bundle with 64GB USB Flash Drive, Mica Silver"
"HP 17 Laptop (17.3"" HD+ Anti-Glare, 64GB RAM, 2TB SSD, Intel Core i3-1125G4 (Beat i5-1035G4)) Home & Business Laptop, 9.5-Hr Long Battery Life, Webcam, Type-C, IST Cable, Win 11 Home, Silver",$699.98,4.5 out of 5 stars,Past sale not found,./Amazon_laptop_files/71e-u3fhaiL._AC_UY218_.jpg,"HP 17 Laptop (17.3"" HD+ Anti-Glare, 64GB RAM, 2TB SSD, Intel Core i3-1125G4 (Beat i5-1035G4)) Home & Business Laptop, 9.5-Hr Long Battery Life, Webcam, Type-C, IST Cable, Win 11 Home, Silver"
"HP EliteBook 840 G5 14 FHD Core i5-8350U 1.7GHz, 16GB RAM, 256GB SSD, Windows 10 Pro 64Bit, CAM (Renewed)",Price not found,Rating not found,Past sale not found,./Amazon_laptop_files/71CkfwHJrJL._AC_UY218_.jpg,"HP EliteBook 840 G5 14 FHD Core i5-8350U 1.7GHz, 16GB RAM, 256GB SSD, Windows 10 Pro 64Bit, CAM (Renewed)"
"Microsoft Surface Laptop Studio 2 (2023) - 14.4"" Touchscreen - Intel Core i7, 16GB RAM, 512GB SSD, NVIDIA GeForce RTX 4050, Windows 11, Platinum Color Copilot",Price not found,Rating not found,No featured offers available,./Amazon_laptop_files/61vqI0vw94L._AC_UY218_.jpg,"Microsoft Surface Laptop Studio 2 (2023) - 14.4"" Touchscreen - Intel Core i7, 16GB RAM, 512GB SSD, NVIDIA GeForce RTX 4050, Windows 11, Platinum Color Copilot"
"HP Notebook 14 Laptop, 14"" HD Display, Intel Core i5-1135G7 (Beats i7-1065G7), 16GB DDR4 Memory, 1TB SSD, Webcam, USB Type-C, HDMI, WiFi, Long Battery Life Up to 9 Hours, TiTac, Windows 11",$549.99,Rating not found,Past sale not found,./Amazon_laptop_files/51Mat4UshZL._AC_UY218_.jpg,"HP Notebook 14 Laptop, 14"" HD Display, Intel Core i5-1135G7 (Beats i7-1065G7), 16GB DDR4 Memory, 1TB SSD, Webcam, USB Type-C, HDMI, WiFi, Long Battery Life Up to 9 Hours, TiTac, Windows 11"
"Lenovo 100e Chromebook Gen 4 11.6"" HD Touchscreen Laptop, Intel N100 0.8GHz, 8GB RAM, 64GB eMMC, ChromeOS, Graphite Gray",Price not found,Rating not found,No featured offers available,./Amazon_laptop_files/61cI3BHVtuL._AC_UY218_.jpg,"Lenovo 100e Chromebook Gen 4 11.6"" HD Touchscreen Laptop, Intel N100 0.8GHz, 8GB RAM, 64GB eMMC, ChromeOS, Graphite Gray"
"Asus ZenBook 14 14X OLED 14.5/inch QHD+(2880x1800)120Hz Touchscreen(Intel 13th Gen i5-13500H(Beat i7-1250U),8GB RAM,2TB SSD) Laptop,NumberPad,Backlit,FHD Webcam,IST HDMI,Win 11 Home Inkwell Gray",$829.98,Rating not found,Past sale not found,./Amazon_laptop_files/81hE4CpHUjL._AC_UY218_.jpg,"Asus ZenBook 14 14X OLED 14.5/inch QHD+(2880x1800)120Hz Touchscreen(Intel 13th Gen i5-13500H(Beat i7-1250U),8GB RAM,2TB SSD) Laptop,NumberPad,Backlit,FHD Webcam,IST HDMI,Win 11 Home Inkwell Gray"
"Dell Latitude 5410 Business Laptop, 14"" FHD WVA (1920 x 1080) Non-Touch, 10th Gen Intel Core i7-10610U, 16GB RAM, 256GB SSD, Fingerprint Reader, Webcam, Windows 11 Pro, XPI Bundle (Renewed)",Price not found,Rating not found,Past sale not found,./Amazon_laptop_files/61CpL-+6xCL._AC_UY218_.jpg,"Dell Latitude 5410 Business Laptop, 14"" FHD WVA (1920 x 1080) Non-Touch, 10th Gen Intel Core i7-10610U, 16GB RAM, 256GB SSD, Fingerprint Reader, Webcam, Windows 11 Pro, XPI Bundle (Renewed)"
"Microsoft Surface Laptop 6 15"" Touchscreen Notebook - Intel Core Ultra 7-16 GB - 256 GB SSD - English Keyboard - Black",Price not found,Rating not found,No featured offers available,./Amazon_laptop_files/51V1h57gb9L._AC_UY218_.jpg,"Microsoft Surface Laptop 6 15"" Touchscreen Notebook - Intel Core Ultra 7-16 GB - 256 GB SSD - English Keyboard - Black"
"HP Chromebook 14-inch HD Laptop, Intel Celeron N4000, 4 GB RAM, 32 GB eMMC, Chrome (14a-na0010nr, Mineral Silver)",$189.98,4.4 out of 5 stars,List:,./Amazon_laptop_files/91shKLxoedL._AC_UY218_.jpg,"HP Chromebook 14-inch HD Laptop, Intel Celeron N4000, 4 GB RAM, 32 GB eMMC, Chrome (14a-na0010nr, Mineral Silver)"
"MSI Stealth 17 Studio 17.3"" QHD 240Hz Gaming Laptop: 13th Gen Intel Core i9, RTX 4080, 32GB DDR5, 1TB NVMe SSD, Thunderbolt 4, USB-Type C, Cooler Boost Trinity+, Win11 Home: Core Black A13VH-053US",Price not found,Rating not found,Past sale not found,./Amazon_laptop_files/714fL2+tNuL._AC_UY218_.jpg,"MSI Stealth 17 Studio 17.3"" QHD 240Hz Gaming Laptop: 13th Gen Intel Core i9, RTX 4080, 32GB DDR5, 1TB NVMe SSD, Thunderbolt 4, USB-Type C, Cooler Boost Trinity+, Win11 Home: Core Black A13VH-053US"
"HP Newest 17t Laptop, 17.3'' HD+ Touchscreen, Intel Core i7-1165G7 Processor, 32GB DDR4 RAM, 1TB PCIe SSD, Backlit Keyboard, HDMI, Windows 11 Home, Silver",Price not found,Rating not found,No featured offers available,./Amazon_laptop_files/81w8rwWYg6L._AC_UY218_.jpg,"HP Newest 17t Laptop, 17.3'' HD+ Touchscreen, Intel Core i7-1165G7 Processor, 32GB DDR4 RAM, 1TB PCIe SSD, Backlit Keyboard, HDMI, Windows 11 Home, Silver"
"ASUS Chromebook C424 14"" Full HD Notebook Computer, Intel Celeron N4020 1.1GHz, 4GB RAM, 64GB eMMC, Chrome OS, Silver",Price not found,Rating not found,No featured offers available,./Amazon_laptop_files/51C1Jt2p1TL._AC_UY218_.jpg,"ASUS Chromebook C424 14"" Full HD Notebook Computer, Intel Celeron N4020 1.1GHz, 4GB RAM, 64GB eMMC, Chrome OS, Silver"
"ASUS Zenbook S 13 OLED Ultra Laptop, 13.3 inch OLED 2.8K Display, Intel Evo Certified, i7-1355U CPU, Intel® Iris Xe Graphics, 32GB RAM, 1TB SSD, Windows 11 Pro, Basalt Grey, UX5304VA-XS76T",Price not found,4.3 out of 5 stars,Past sale not found,./Amazon_laptop_files/71zAKORB6hL._AC_UY218_.jpg,"ASUS Zenbook S 13 OLED Ultra Laptop, 13.3 inch OLED 2.8K Display, Intel Evo Certified, i7-1355U CPU, Intel® Iris Xe Graphics, 32GB RAM, 1TB SSD, Windows 11 Pro, Basalt Grey, UX5304VA-XS76T"
"LG gram 16” 2in1 Lightweight Laptop, Intel 13th Gen Core i7 Evo Platform, Windows 11 Home, 16GB RAM, 512GB SSD, Black",Price not found,Rating not found,No featured offers available,./Amazon_laptop_files/717pottSkKL._AC_UY218_.jpg,"LG gram 16” 2in1 Lightweight Laptop, Intel 13th Gen Core i7 Evo Platform, Windows 11 Home, 16GB RAM, 512GB SSD, Black"
"HP Chromebook 11-inch Laptop - Up to 15 Hour Battery Life - MediaTek - MT8183 - 4 GB RAM - 32 GB eMMC Storage - 11.6-inch HD Display - with Chrome OS™ - (11a-na0021nr, 2020 model, Snow White)",Price not found,4.4 out of 5 stars,No featured offers available,./Amazon_laptop_files/716Daz3br+L._AC_UY218_.jpg,"HP Chromebook 11-inch Laptop - Up to 15 Hour Battery Life - MediaTek - MT8183 - 4 GB RAM - 32 GB eMMC Storage - 11.6-inch HD Display - with Chrome OS™ - (11a-na0021nr, 2020 model, Snow White)"
"HP 15 Pavilion Laptop (15.6"" HD Touchscreen, Intel Core i3-1115G4 (> i5-1035G4), 32GB RAM, 1TB SSD) Home & Student Laptop, Narrow-Bezel, Long Battery Life, Webcam, Numpad, Fast Charge, Windows 11 Home",$549.99,Rating not found,Past sale not found,./Amazon_laptop_files/716Sqmp1RCL._AC_UY218_.jpg,"HP 15 Pavilion Laptop (15.6"" HD Touchscreen, Intel Core i3-1115G4 (> i5-1035G4), 32GB RAM, 1TB SSD) Home & Student Laptop, Narrow-Bezel, Long Battery Life, Webcam, Numpad, Fast Charge, Windows 11 Home"
"Acer Chromebook 516 GE 16'' QHD (Intel 12th Gen Core i5-1240P, 8GB RAM, 512GB PCIe SSD, RGB Backlit) Cloud Gaming & Business Laptop, WiFi 6E, RJ45, FHD, IST Cable, Chrome OS - 2023, Titanium Gray",$549.98,Rating not found,Past sale not found,./Amazon_laptop_files/71qNTRNjC-L._AC_UY218_.jpg,"Acer Chromebook 516 GE 16'' QHD (Intel 12th Gen Core i5-1240P, 8GB RAM, 512GB PCIe SSD, RGB Backlit) Cloud Gaming & Business Laptop, WiFi 6E, RJ45, FHD, IST Cable, Chrome OS - 2023, Titanium Gray"
"HP Envy Laptop, 17.3"" Full HD Touchscreen, 12th Gen Intel Core i7-1260P, 16GB DDR4 RAM, 1TB PCIe SSD, IR Camera, HDMI, Backlit Keyboard, Wi-Fi 6, Windows 11 Home, Silver",Price not found,Rating not found,No featured offers available,./Amazon_laptop_files/71PztFRhT-L._AC_UY218_.jpg,"HP Envy Laptop, 17.3"" Full HD Touchscreen, 12th Gen Intel Core i7-1260P, 16GB DDR4 RAM, 1TB PCIe SSD, IR Camera, HDMI, Backlit Keyboard, Wi-Fi 6, Windows 11 Home, Silver"
"Dell Latitude 7000 7400 Laptop (2019) | 14"""" FHD | Core i7-512GB SSD Hard Drive - 16GB RAM | 4 Cores @ 4.8 GHz Win 11 Pro, Black (Renewed)",$319.00,Rating not found,Past sale not found,./Amazon_laptop_files/51pzHxdsBLL._AC_UY218_.jpg,"Dell Latitude 7000 7400 Laptop (2019) | 14"""" FHD | Core i7-512GB SSD Hard Drive - 16GB RAM | 4 Cores @ 4.8 GHz Win 11 Pro, Black (Renewed)"
"Dell G15 5530 G-Series Gaming Laptop - 15.6-inch FHD 165Hz 3ms (1920x1080) Display, Intel Core i7-13650HX, 16GB DDR5 RAM, 1TB SSD, NVIDIA GeForce RTX 4060 8GB GDDR6, Windows 11 Home, Onsite Service",Price not found,Rating not found,No featured offers available,./Amazon_laptop_files/71ApWLaIWFL._AC_UY218_.jpg,"Dell G15 5530 G-Series Gaming Laptop - 15.6-inch FHD 165Hz 3ms (1920x1080) Display, Intel Core i7-13650HX, 16GB DDR5 RAM, 1TB SSD, NVIDIA GeForce RTX 4060 8GB GDDR6, Windows 11 Home, Onsite Service"
"ASUS VivoBook 15 Thin and Light Laptop, 15.6” HD Display, Intel Celeron N4020 Processor, 4GB DDR4 SO-DIMM, 1TB SATA 5400RPM 2.5"" HDD, Windows 10 Home, Slate Grey, R565MA-RB05",Price not found,Rating not found,No featured offers available,./Amazon_laptop_files/81HUTXm2ClL._AC_UY218_.jpg,"ASUS VivoBook 15 Thin and Light Laptop, 15.6” HD Display, Intel Celeron N4020 Processor, 4GB DDR4 SO-DIMM, 1TB SATA 5400RPM 2.5"" HDD, Windows 10 Home, Slate Grey, R565MA-RB05"
