Title,Price,Rating,Past Sale,Image URL,Specifications
"HP 2024 Stream 14"" HD Thin and Light Laptop, Intel Celeron N4120, 16GB RAM, 128GB eMMC Storage, Long Battery Life, HD Webcam, HDMI, Rose Gold, Office 365 1-Year, Windows 11 S, 128GB Cuertns MicroSD",Price not found,4.3 out of 5 stars,No featured offers available,./Amazon_laptop_files/61uQp+dLBDL._AC_UY218_.jpg,"HP 2024 Stream 14"" HD Thin and Light Laptop, Intel Celeron N4120, 16GB RAM, 128GB eMMC Storage, Long Battery Life, HD Webcam, HDMI, Rose Gold, Office 365 1-Year, Windows 11 S, 128GB Cuertns MicroSD"
"HP High Performance Business Laptop - 17.3"" HD+ Touchscreen - 10-Core 12th Intel i7-1255U Iris Xe Graphics - 32GB DDR4-1TB SSD - WiFi 6 Bluetooth - Backlit Keyboard - Win 11 Pro w/ 32GB USB",Price not found,Rating not found,No featured offers available,./Amazon_laptop_files/611DiOFTVfL._AC_UY218_.jpg,"HP High Performance Business Laptop - 17.3"" HD+ Touchscreen - 10-Core 12th Intel i7-1255U Iris Xe Graphics - 32GB DDR4-1TB SSD - WiFi 6 Bluetooth - Backlit Keyboard - Win 11 Pro w/ 32GB USB"
"Kensington MP16 MacBook Magnetic Privacy Screen for 16"" MacBook Pro (2021 and Newer)",$41.58,4.3 out of 5 stars,50+ bought in past month,./Amazon_laptop_files/71hqLQQs0lL._AC_UY218_.jpg,"Kensington MP16 MacBook Magnetic Privacy Screen for 16"" MacBook Pro (2021 and Newer)"
"Everki Advance Laptop Briefcase Bag 17.3 Inch - Business Briefcase for Men & Women,Computer Bag for Laptops, Laptop Travel Bag, Heavy Duty Laptop Bag, Laptop Carrying Bag- (EKB407NCH17) Black",$49.99,4.7 out of 5 stars,Past sale not found,./Amazon_laptop_files/81FQ+JwEwJL._AC_UY218_.jpg,"Everki Advance Laptop Briefcase Bag 17.3 Inch - Business Briefcase for Men & Women,Computer Bag for Laptops, Laptop Travel Bag, Heavy Duty Laptop Bag, Laptop Carrying Bag- (EKB407NCH17) Black"
"[2021 Version]ASUS Vivobook Laptop L210 11.6” ultra thin, Intel Celeron N4020 Processor, 4GB RAM, 64GB eMMC storage, Windows 10 Home in S mode with One Year of Office 365 Personal, L210MA-DB01",Price not found,4.3 out of 5 stars,No featured offers available,./Amazon_laptop_files/810BY5U9baL._AC_UY218_.jpg,"[2021 Version]ASUS Vivobook Laptop L210 11.6” ultra thin, Intel Celeron N4020 Processor, 4GB RAM, 64GB eMMC storage, Windows 10 Home in S mode with One Year of Office 365 Personal, L210MA-DB01"
"acer Swift 3 Intel Evo Thin & Light Laptop 14.0"" Full HD IPS Intel Core i7-1165G7 Intel Iris Xe Graphics 16GB LPDDR4X 512GB NVMe SSD WiFi 6 Back-lit KB Windows 11 Home SF314-511-753K",Price not found,Rating not found,No featured offers available,./Amazon_laptop_files/71rY4dOiSrL._AC_UY218_.jpg,"acer Swift 3 Intel Evo Thin & Light Laptop 14.0"" Full HD IPS Intel Core i7-1165G7 Intel Iris Xe Graphics 16GB LPDDR4X 512GB NVMe SSD WiFi 6 Back-lit KB Windows 11 Home SF314-511-753K"
"HP 2024 Premium 14"" Touchscreen Laptop, Intel Quad-Core Processor Up to 2.50GHz, 4GB Ram, 64GB Storage, Super-Fast WiFi, HDMI, Windows 11, Dark Gray (Renewed)",Price not found,Rating not found,Past sale not found,./Amazon_laptop_files/71BG8gRj5YL._AC_UY218_.jpg,"HP 2024 Premium 14"" Touchscreen Laptop, Intel Quad-Core Processor Up to 2.50GHz, 4GB Ram, 64GB Storage, Super-Fast WiFi, HDMI, Windows 11, Dark Gray (Renewed)"
"HP 15.6 inch Laptop, Intel Core i5-1135G7 Processor, 15.6"" FHD Anti-Glare LED Display, HDMI, Wi-Fi and Bluetooth, Lightweight Design, Fast Charge, Windows 11 Home (32GB RAM | 1TB SSD)",$530.99,Rating not found,More Buying Choices,./Amazon_laptop_files/71KQlw+d-yL._AC_UY218_.jpg,"HP 15.6 inch Laptop, Intel Core i5-1135G7 Processor, 15.6"" FHD Anti-Glare LED Display, HDMI, Wi-Fi and Bluetooth, Lightweight Design, Fast Charge, Windows 11 Home (32GB RAM | 1TB SSD)"
"Apple 2024 MacBook Air 13-inch Laptop with M3 chip: 8GB Memory, 256GB Storage; Starlight with AppleCare+ (3 Years)","$1,148.00",4.7 out of 5 stars,List:,./Amazon_laptop_files/61IU99MrvIL._AC_UY218_.jpg,"Apple 2024 MacBook Air 13-inch Laptop with M3 chip: 8GB Memory, 256GB Storage; Starlight with AppleCare+ (3 Years)"
"ASUS VivoBook S 15 OLED Slim Laptop, 15.6” FHD OLED Display, Intel Evo Platform, Intel Core i5-12500H CPU, 8GB RAM, 512GB SSD, Windows 11 Home, Indie Black, K3502ZA-DS51",Price not found,Rating not found,No featured offers available,./Amazon_laptop_files/717JH3sDRDL._AC_UY218_.jpg,"ASUS VivoBook S 15 OLED Slim Laptop, 15.6” FHD OLED Display, Intel Evo Platform, Intel Core i5-12500H CPU, 8GB RAM, 512GB SSD, Windows 11 Home, Indie Black, K3502ZA-DS51"
"HP 14 Laptop, Intel Celeron N4020, 4 GB RAM, 64 GB Storage, 14-inch HD Touchscreen, Windows 11 Home, Thin & Portable, 4K Graphics, One Year of Microsoft 365 (14-dq0080nr, Snowflake White)",Price not found,Rating not found,100+ bought in past month,./Amazon_laptop_files/51WLQFo6gBL._AC_UY218_.jpg,"HP 14 Laptop, Intel Celeron N4020, 4 GB RAM, 64 GB Storage, 14-inch HD Touchscreen, Windows 11 Home, Thin & Portable, 4K Graphics, One Year of Microsoft 365 (14-dq0080nr, Snowflake White)"
"ASUS 14"" FHD Chromebook Laptop, Intel M3-8100Y Processor, 8GB RAM, 224GB Storage (64GB SSD+ 160GB Docking Station Set), Intel HD Graphics, Backlit Keyboard, HD Webcam, Chrome OS, Silver",Price not found,4.3 out of 5 stars,No featured offers available,./Amazon_laptop_files/81HGUUgtCGL._AC_UY218_.jpg,"ASUS 14"" FHD Chromebook Laptop, Intel M3-8100Y Processor, 8GB RAM, 224GB Storage (64GB SSD+ 160GB Docking Station Set), Intel HD Graphics, Backlit Keyboard, HD Webcam, Chrome OS, Silver"
"HP 17.3"" HD Plus Laptop, for Business and Students, Intel Quad Core, 16GB RAM, 1TB NVMe SSD, Fullsize Keyboard, HDMI, Rapid Charge, Type-C, Windows 11 with Bundled Accessories",$475.00,4.4 out of 5 stars,More Buying Choices,./Amazon_laptop_files/81N9gJ8ULIL._AC_UY218_.jpg,"HP 17.3"" HD Plus Laptop, for Business and Students, Intel Quad Core, 16GB RAM, 1TB NVMe SSD, Fullsize Keyboard, HDMI, Rapid Charge, Type-C, Windows 11 with Bundled Accessories"
"Dell Latitude 7480 FHD (1920x1080) Ultrabook Business Laptop Notebook (Intel Core i7-7600U, 16GB Ram, 512GB Solid State SSD, HDMI, Camera, WiFi, Thunderbolt 3) Win 10 Pro (Renewed)",Price not found,Rating not found,50+ bought in past month,./Amazon_laptop_files/717zxQAOCuL._AC_UY218_.jpg,"Dell Latitude 7480 FHD (1920x1080) Ultrabook Business Laptop Notebook (Intel Core i7-7600U, 16GB Ram, 512GB Solid State SSD, HDMI, Camera, WiFi, Thunderbolt 3) Win 10 Pro (Renewed)"
"Lenovo ThinkBook 15 Gen 4 15.6"" FHD (12th Gen Intel 10-Core i7-1255U, 40GB RAM, 1TB PCIe SSD, Narrow Bezel IPS) Business Laptop, 1080p Webcam, Fingerprint, IST SD Card, Win 11 Pro, Grey - 2024",$769.98,Rating not found,More Buying Choices,./Amazon_laptop_files/713agomBA8L._AC_UY218_.jpg,"Lenovo ThinkBook 15 Gen 4 15.6"" FHD (12th Gen Intel 10-Core i7-1255U, 40GB RAM, 1TB PCIe SSD, Narrow Bezel IPS) Business Laptop, 1080p Webcam, Fingerprint, IST SD Card, Win 11 Pro, Grey - 2024"
"Lenovo Flex 5 Laptop, 14.0"" FHD Touch Display, AMD Ryzen 5 5500U, 16GB RAM, 512GB Storage, AMD Radeon Graphics, Windows 11 Home, Storm Grey",Price not found,Rating not found,No featured offers available,./Amazon_laptop_files/61bicZhOScL._AC_UY218_.jpg,"Lenovo Flex 5 Laptop, 14.0"" FHD Touch Display, AMD Ryzen 5 5500U, 16GB RAM, 512GB Storage, AMD Radeon Graphics, Windows 11 Home, Storm Grey"
"Lenovo IdeaPad 3 3i Laptop (15.6"" FHD Touchscreen, Intel Core i5-1155G7, 16GB RAM, 512GB SSD) Narrow Bezel, Webcam, 12-Hr Long Battery Life, Wi-Fi 6, IST SD, Win 11 Home, Business & Home, Abyss Blue",$529.98,Rating not found,Past sale not found,./Amazon_laptop_files/81OW0rW2lwL._AC_UY218_.jpg,"Lenovo IdeaPad 3 3i Laptop (15.6"" FHD Touchscreen, Intel Core i5-1155G7, 16GB RAM, 512GB SSD) Narrow Bezel, Webcam, 12-Hr Long Battery Life, Wi-Fi 6, IST SD, Win 11 Home, Business & Home, Abyss Blue"
"Dell Inspiron 15 3000 3520 15.6"" FHD Touchscreen (Intel 4-Core i5-1135G7, 32GB RAM, 1TB PCIe SSD, UHD Graphics) Business Laptop, WVA Anti-Glare, Numeric Keypad, Webcam, Wi-Fi, Win 11 Pro - 2024 Black",$589.99,Rating not found,50+ bought in past month,./Amazon_laptop_files/61apmtXrgQL._AC_UY218_.jpg,"Dell Inspiron 15 3000 3520 15.6"" FHD Touchscreen (Intel 4-Core i5-1135G7, 32GB RAM, 1TB PCIe SSD, UHD Graphics) Business Laptop, WVA Anti-Glare, Numeric Keypad, Webcam, Wi-Fi, Win 11 Pro - 2024 Black"
"HP 15.6 Inch Laptop, Intel Iris Xe Graphics, 11th Generation Intel Core Processor, 8 GB RAM, 256 GB SSD, Windows 11 Home (15-dy2024nr, Natural silver)",Price not found,4.4 out of 5 stars,No featured offers available,./Amazon_laptop_files/71RD3vsjIYL._AC_UY218_.jpg,"HP 15.6 Inch Laptop, Intel Iris Xe Graphics, 11th Generation Intel Core Processor, 8 GB RAM, 256 GB SSD, Windows 11 Home (15-dy2024nr, Natural silver)"
"MSI Katana 15 15.6"" 144Hz FHD Gaming Laptop: 13th Gen Intel Core i7, RTX 4070, 16GB DDR5, 1TB NVMe SSD, USB-Type C, Cooler Boost 5, Win11 Home: Black B13VGK-484US",Price not found,Rating not found,No featured offers available,./Amazon_laptop_files/81K1NR+8WjL._AC_UY218_.jpg,"MSI Katana 15 15.6"" 144Hz FHD Gaming Laptop: 13th Gen Intel Core i7, RTX 4070, 16GB DDR5, 1TB NVMe SSD, USB-Type C, Cooler Boost 5, Win11 Home: Black B13VGK-484US"
"USB-C 9-in-1 Dual Display Docking Station with HDMI, Ethernet, USB, 3.5mm Audio and Power Delivery up to 60W - 4K 30Hz (TAA Compliant)",$127.00,Rating not found,Past sale not found,./Amazon_laptop_files/41d3fb6VcKL._AC_UY218_.jpg,"USB-C 9-in-1 Dual Display Docking Station with HDMI, Ethernet, USB, 3.5mm Audio and Power Delivery up to 60W - 4K 30Hz (TAA Compliant)"
StarTech.com FireWire800 ExpressCard Adapter for Laptops,$54.19,Rating not found,($13.55$13.55/oz),./Amazon_laptop_files/81walZxb7ZL._AC_UY218_.jpg,StarTech.com FireWire800 ExpressCard Adapter for Laptops
"HP 14-inch Chromebook HD Touchscreen Laptop PC (Intel Celeron N3350 up to 2.4GHz, 4GB RAM, 32GB Flash Memory, WiFi, HD Camera, Bluetooth, Up to 10 hrs Battery Life, Chrome OS , Black)",Price not found,4.5 out of 5 stars,50+ bought in past month,./Amazon_laptop_files/51mf7YyNggS._AC_UY218_.jpg,"HP 14-inch Chromebook HD Touchscreen Laptop PC (Intel Celeron N3350 up to 2.4GHz, 4GB RAM, 32GB Flash Memory, WiFi, HD Camera, Bluetooth, Up to 10 hrs Battery Life, Chrome OS , Black)"
"ASUS Vivobook 15 Laptop, 15.6â€ FHD (1920 x 1080) Display, Intel Core i3-1215U CPU, Intel UHD Graphics, 8GB RAM, 128GB SSD, Windows 11 Home in S Mode, Quiet Blue, F1504ZA-AS34",Price not found,4.3 out of 5 stars,No featured offers available,./Amazon_laptop_files/71BVGVy9nQL._AC_UY218_.jpg,"ASUS Vivobook 15 Laptop, 15.6â€ FHD (1920 x 1080) Display, Intel Core i3-1215U CPU, Intel UHD Graphics, 8GB RAM, 128GB SSD, Windows 11 Home in S Mode, Quiet Blue, F1504ZA-AS34"
"HP Chromebook 15 15.6"" HD (Intel Pentium N6000, 8GB RAM, 128GB Storage (64GB eMMc + 64GB SD Card), UHD Graphics, Numeric KB) Home & Student Laptop, Anti-Glare, Webcam, Wi-Fi, Chrome OS, Silver",$299.98,4.4 out of 5 stars,200+ bought in past month,./Amazon_laptop_files/61fBSyMHtdL._AC_UY218_.jpg,"HP Chromebook 15 15.6"" HD (Intel Pentium N6000, 8GB RAM, 128GB Storage (64GB eMMc + 64GB SD Card), UHD Graphics, Numeric KB) Home & Student Laptop, Anti-Glare, Webcam, Wi-Fi, Chrome OS, Silver"
"ASUS Vivobook 14"" HD Touch Screen Laptop Computer, 11th Gen Intel Core i3-1115G4, 8GB Memory, 128GB SSD, Intel UHD Graphics, Windows 11 Home, Silver - X1400EA-I38128",$344.88,Rating not found,More Buying Choices,./Amazon_laptop_files/61BcPnGqEaL._AC_UY218_.jpg,"ASUS Vivobook 14"" HD Touch Screen Laptop Computer, 11th Gen Intel Core i3-1115G4, 8GB Memory, 128GB SSD, Intel UHD Graphics, Windows 11 Home, Silver - X1400EA-I38128"
"ASUS Vivobook Go 15 L510 Thin & Light Laptop Computer, 15.6” FHD Display, Intel Celeron N4020 Processor, 4GB RAM, 64GB Storage, Windows 11 Home in S Mode, 1 Year Microsoft 365, Star Black, L510MA-AS02",Price not found,Rating not found,No featured offers available,./Amazon_laptop_files/51U9xem9OxL._AC_UY218_.jpg,"ASUS Vivobook Go 15 L510 Thin & Light Laptop Computer, 15.6” FHD Display, Intel Celeron N4020 Processor, 4GB RAM, 64GB Storage, Windows 11 Home in S Mode, 1 Year Microsoft 365, Star Black, L510MA-AS02"
"SAMSUNG 16"" Galaxy Book3 Pro Business Laptop Computer/Windows 11 PRO / 32GB / 1TB, 13th Gen Intel® Core™ i7 processor, Intel® Evo™ platform, Lightweight, 2023 Model, NP964XFG-KC1US, Graphite",Price not found,Rating not found,Past sale not found,./Amazon_laptop_files/71pozxyNy-L._AC_UY218_.jpg,"SAMSUNG 16"" Galaxy Book3 Pro Business Laptop Computer/Windows 11 PRO / 32GB / 1TB, 13th Gen Intel® Core™ i7 processor, Intel® Evo™ platform, Lightweight, 2023 Model, NP964XFG-KC1US, Graphite"
"Lenovo IdeaPad 3 Laptop, 15.6” FHD Touchscreen Display, Intel Core i5-1135G7 Processor, 20GB RAM, 1TB SSD, Wi-Fi 6, SD Card Reader, HDMI, Webcam, Windows 11 Pro, Grey",$572.69,4.3 out of 5 stars,More Buying Choices,./Amazon_laptop_files/61fQ3g11shL._AC_UY218_.jpg,"Lenovo IdeaPad 3 Laptop, 15.6” FHD Touchscreen Display, Intel Core i5-1135G7 Processor, 20GB RAM, 1TB SSD, Wi-Fi 6, SD Card Reader, HDMI, Webcam, Windows 11 Pro, Grey"
Dell Latitude 5420 Laptop 14 - Intel Core i5 11th Gen - i5-1135G7 - Quad Core 4.2Ghz - 512GB SSD - 16GB RAM - 1920x1080 FHD - Windows 10 Pro (Renewed),Price not found,Rating not found,Past sale not found,./Amazon_laptop_files/614L0tVSDrS._AC_UY218_.jpg,Dell Latitude 5420 Laptop 14 - Intel Core i5 11th Gen - i5-1135G7 - Quad Core 4.2Ghz - 512GB SSD - 16GB RAM - 1920x1080 FHD - Windows 10 Pro (Renewed)
"HP [Windows 11 Pro 15.6"" FHD Business Laptop Computer, Intel Core i5-1135G7, 16GB RAM 512GB SSD, w/Hub",Price not found,Rating not found,No featured offers available,./Amazon_laptop_files/71+WryrZoJL._AC_UY218_.jpg,"HP [Windows 11 Pro 15.6"" FHD Business Laptop Computer, Intel Core i5-1135G7, 16GB RAM 512GB SSD, w/Hub"
"Lenovo ThinkPad T14 Business Laptop (14"" FHD Anti-Glare, Intel 4-Core i5-1135G7, 16GB RAM, 512GB SSD), Backlit Keyboard, Fingerprint, 2 x Thunderbolt 4, Webcam, 3-Year Warranty, Win 11 Pro, Black",$949.98,4.3 out of 5 stars,More Buying Choices,./Amazon_laptop_files/61sBHNv9ILL._AC_UY218_.jpg,"Lenovo ThinkPad T14 Business Laptop (14"" FHD Anti-Glare, Intel 4-Core i5-1135G7, 16GB RAM, 512GB SSD), Backlit Keyboard, Fingerprint, 2 x Thunderbolt 4, Webcam, 3-Year Warranty, Win 11 Pro, Black"
"Acer Chromebook Spin 311 Convertible Laptop, Intel Celeron N4020, 11.6"" HD Touch, 4GB LPDDR4, 32GB eMMC, Gigabit Wi-Fi 5, Bluetooth 5.0, Google Chrome, CP311-2H-C679",$299.00,4.5 out of 5 stars,400+ bought in past month,./Amazon_laptop_files/61dsJm45m3L._AC_UY218_.jpg,"Acer Chromebook Spin 311 Convertible Laptop, Intel Celeron N4020, 11.6"" HD Touch, 4GB LPDDR4, 32GB eMMC, Gigabit Wi-Fi 5, Bluetooth 5.0, Google Chrome, CP311-2H-C679"
"HP 15.6-inch HD Laptop, AMD Ryzen 3 3200U Processor, 8 GB RAM, 256 GB SSD, Windows 10 Home (15-ef0021nr, Natural Silver)",$345.99,4.3 out of 5 stars,More Buying Choices,./Amazon_laptop_files/716nFhZx5ML._AC_UY218_.jpg,"HP 15.6-inch HD Laptop, AMD Ryzen 3 3200U Processor, 8 GB RAM, 256 GB SSD, Windows 10 Home (15-ef0021nr, Natural Silver)"
"HP 14 Laptop, Intel Celeron N4020, 4 GB RAM, 64 GB Storage, 14-inch HD Touchscreen, Windows 11 Home, Thin & Portable, 4K Graphics, One Year of Microsoft 365 (14-dq0050nr, Indigo Blue)",Price not found,Rating not found,No featured offers available,./Amazon_laptop_files/81lFbTxpl6S._AC_UY218_.jpg,"HP 14 Laptop, Intel Celeron N4020, 4 GB RAM, 64 GB Storage, 14-inch HD Touchscreen, Windows 11 Home, Thin & Portable, 4K Graphics, One Year of Microsoft 365 (14-dq0050nr, Indigo Blue)"
"ASUS VivoBook 16 Laptop, 16” WUXGA (1920 x 1200) 16:10 Display, AMD Ryzen 9 7940HS CPU, AMD Radeon™ Graphics, 16GB RAM, 1TB SSD, Windows 11 Home, Cool Silver, M1605XA-EB96",Price not found,Rating not found,Past sale not found,./Amazon_laptop_files/71uxtzvj+OL._AC_UY218_.jpg,"ASUS VivoBook 16 Laptop, 16” WUXGA (1920 x 1200) 16:10 Display, AMD Ryzen 9 7940HS CPU, AMD Radeon™ Graphics, 16GB RAM, 1TB SSD, Windows 11 Home, Cool Silver, M1605XA-EB96"
"Samsung Chromebook Laptop, 15.6"" FHD LED Display, Intel Celeron N4000, 4GB RAM, 64GB eMMC, HD Webcam, Wi-Fi 5, Bluetooth, Chrome OS, Platinum Titan, 32GB USB Card",Price not found,4.4 out of 5 stars,50+ bought in past month,./Amazon_laptop_files/71NXGF9AxwL._AC_UY218_.jpg,"Samsung Chromebook Laptop, 15.6"" FHD LED Display, Intel Celeron N4000, 4GB RAM, 64GB eMMC, HD Webcam, Wi-Fi 5, Bluetooth, Chrome OS, Platinum Titan, 32GB USB Card"
"HP 2023 Newest Laptop Pavilion 17.3"" HD+ Laptop Computer, AMD Ryzen 3 7320U(Up to 4.1GHz, Beat i3-1125G4), AMD Radeon Graphics, 8GB DDR5 RAM, 1TB NVMe SSD, WiFi 6, HDMI, Numeric Keypad, Windows 11",$442.99,Rating not found,More Buying Choices,./Amazon_laptop_files/61SSAt4EirL._AC_UY218_.jpg,"HP 2023 Newest Laptop Pavilion 17.3"" HD+ Laptop Computer, AMD Ryzen 3 7320U(Up to 4.1GHz, Beat i3-1125G4), AMD Radeon Graphics, 8GB DDR5 RAM, 1TB NVMe SSD, WiFi 6, HDMI, Numeric Keypad, Windows 11"
"Everki Studio Expandable 15 Inch MacBook & Laptop Backpack for Men & Women, Travel Friendly Backpack, Professional Office Backpack for Men, Bookbag and Computer Backpack, Offers 26L Capacity - Black",$151.77,4.4 out of 5 stars,Past sale not found,./Amazon_laptop_files/91pyElgvygL._AC_UY218_.jpg,"Everki Studio Expandable 15 Inch MacBook & Laptop Backpack for Men & Women, Travel Friendly Backpack, Professional Office Backpack for Men, Bookbag and Computer Backpack, Offers 26L Capacity - Black"
"Kensington Contour Computer Backpack for 16"" Laptops (K62238B), Black",$69.99,Rating not found,List:,./Amazon_laptop_files/71uy7UEQ3QL._AC_UY218_.jpg,"Kensington Contour Computer Backpack for 16"" Laptops (K62238B), Black"
Dell Latitude 5590 Business Laptop | 15.6in HD Screen | Intel Quad Core 8th Gen i7-8650U | 16GB DDR4 RAM | 512GB SSD | Windows 10 Professional (Renewed),Price not found,Rating not found,50+ bought in past month,./Amazon_laptop_files/61fNtN82ymL._AC_UY218_.jpg,Dell Latitude 5590 Business Laptop | 15.6in HD Screen | Intel Quad Core 8th Gen i7-8650U | 16GB DDR4 RAM | 512GB SSD | Windows 10 Professional (Renewed)
"ASUS C424MA-AS48F Chromebook C424, 14.0"" 180 Degree FHD NanoEdge Display, Intel Dual Core Celeron Processor, 4GB LPDDR4 RAM, 128GB Storage, Silver Color, C424MA-AS48F",Price not found,4.3 out of 5 stars,50+ bought in past month,./Amazon_laptop_files/71DL+S6ihBL._AC_UY218_.jpg,"ASUS C424MA-AS48F Chromebook C424, 14.0"" 180 Degree FHD NanoEdge Display, Intel Dual Core Celeron Processor, 4GB LPDDR4 RAM, 128GB Storage, Silver Color, C424MA-AS48F"
"HP Stream 14-inch Laptop, Intel Celeron N4000, 4 GB RAM, 64 GB eMMC, Windows 10 Home in S Mode With Office 365 Personal For 1 Year (14-cb185nr, Royal Blue)",$217.49,Rating not found,More Buying Choices,./Amazon_laptop_files/81RCOr3hJOL._AC_UY218_.jpg,"HP Stream 14-inch Laptop, Intel Celeron N4000, 4 GB RAM, 64 GB eMMC, Windows 10 Home in S Mode With Office 365 Personal For 1 Year (14-cb185nr, Royal Blue)"
"Lenovo IdeaPad 3 – (2023) - Everyday Notebook - Windows 11-14"" Full HD – 8GB Memory – 128GB Storage - Intel Core i3-1115G - Platinum Grey",Price not found,4.4 out of 5 stars,No featured offers available,./Amazon_laptop_files/81sq-a+suJL._AC_UY218_.jpg,"Lenovo IdeaPad 3 – (2023) - Everyday Notebook - Windows 11-14"" Full HD – 8GB Memory – 128GB Storage - Intel Core i3-1115G - Platinum Grey"
"SAMSUNG 16"" Galaxy Book4 Pro Laptop PC Computer, Intel Core 7 Ultra Processor 1TB, 3K AMOLED (2880 x 1800) Touchscreen, Advanced Security, 2024 Model, NP960XGK-KG1US, Moonstone Gray","$1,749.99",4.4 out of 5 stars,50+ bought in past month,./Amazon_laptop_files/71ysHVMH4FL._AC_UY218_.jpg,"SAMSUNG 16"" Galaxy Book4 Pro Laptop PC Computer, Intel Core 7 Ultra Processor 1TB, 3K AMOLED (2880 x 1800) Touchscreen, Advanced Security, 2024 Model, NP960XGK-KG1US, Moonstone Gray"
"ASUS ROG Strix G16 (2023) Gaming Laptop, 16” Nebula Display 16:10 QHD 240Hz, GeForce RTX 4070, Intel Core i9-13980HX, 32GB DDR5, 1TB PCIe SSD, Wi-Fi 6E, Windows 11 Pro, G614JI-XS96,Eclipse Gray",Price not found,4.3 out of 5 stars,No featured offers available,./Amazon_laptop_files/81Ql+nOEynL._AC_UY218_.jpg,"ASUS ROG Strix G16 (2023) Gaming Laptop, 16” Nebula Display 16:10 QHD 240Hz, GeForce RTX 4070, Intel Core i9-13980HX, 32GB DDR5, 1TB PCIe SSD, Wi-Fi 6E, Windows 11 Pro, G614JI-XS96,Eclipse Gray"
"HP EliteBook 845 G8 Business Laptop, 14"""" FHD (1920 x 1080) Non-Touch, AMD Ryzen 5 PRO 5650U, 32GB Ram, 1TB SSD, Fingerprint Reader, Webcam, Windows 11 Pro, XPI Bundle, Silver",Price not found,Rating not found,No featured offers available,./Amazon_laptop_files/61EeAw0uPGL._AC_UY218_.jpg,"HP EliteBook 845 G8 Business Laptop, 14"""" FHD (1920 x 1080) Non-Touch, AMD Ryzen 5 PRO 5650U, 32GB Ram, 1TB SSD, Fingerprint Reader, Webcam, Windows 11 Pro, XPI Bundle, Silver"
"HP Chromebook 11.6-inch Laptop, MediaTek MT8183, MediaTek Integrated Graphics, 4 GB RAM, 32 GB eMMC Storage, Chrome (11a-na0010nr, Ash Gray) (Renewed)",$109.00,Rating not found,More Buying Choices,./Amazon_laptop_files/81EY2GIfktL._AC_UY218_.jpg,"HP Chromebook 11.6-inch Laptop, MediaTek MT8183, MediaTek Integrated Graphics, 4 GB RAM, 32 GB eMMC Storage, Chrome (11a-na0010nr, Ash Gray) (Renewed)"
"HP 17 Laptop (17.3"" HD+ Touchscreen, Intel Pentium N5030, 16GB RAM, 512GB SSD, UHD Graphics) Home & Business, 1-Year Office 365, Long Battery Life, Webcam, Numpad, IST HDMI, Win 11 Home, Silver",$499.99,Rating not found,Typical:,./Amazon_laptop_files/71m05+h-hoL._AC_UY218_.jpg,"HP 17 Laptop (17.3"" HD+ Touchscreen, Intel Pentium N5030, 16GB RAM, 512GB SSD, UHD Graphics) Home & Business, 1-Year Office 365, Long Battery Life, Webcam, Numpad, IST HDMI, Win 11 Home, Silver"
"ASUS Zenbook S 13 OLED Laptop, 13.3” OLED 3K 60Hz Display, Intel Evo Certified, Intel Core Ultra 7 155U CPU, Intel Graphics, 32GB RAM, 1TB SSD, Windows 11 Pro, Basalt Gray, UX5304MA-XS76",Price not found,Rating not found,50+ bought in past month,./Amazon_laptop_files/61TgDEN6HXL._AC_UY218_.jpg,"ASUS Zenbook S 13 OLED Laptop, 13.3” OLED 3K 60Hz Display, Intel Evo Certified, Intel Core Ultra 7 155U CPU, Intel Graphics, 32GB RAM, 1TB SSD, Windows 11 Pro, Basalt Gray, UX5304MA-XS76"
"Lenovo IdeaPad 3 11 Chromebook Laptop,11.6"" HD Display,Intel Celeron N4020, 4GB RAM, 64GB Storage, UHD Graphics 600, Chrome OS, Onyx Black",Price not found,4.3 out of 5 stars,No featured offers available,./Amazon_laptop_files/51iVT7XrGLL._AC_UY218_.jpg,"Lenovo IdeaPad 3 11 Chromebook Laptop,11.6"" HD Display,Intel Celeron N4020, 4GB RAM, 64GB Storage, UHD Graphics 600, Chrome OS, Onyx Black"
"Dell Inspiron 15 3520 (2024) Business Laptop (15.6"" FHD Touchscreen IPS, Intel Core i5-1155G7, 16GB RAM, 512GB SSD) Numeric Keypad, Narrow-Bezel, Webcam, Inspiron 3000, Win 11 Home, Carbon Black",$494.98,4.6 out of 5 stars,Past sale not found,./Amazon_laptop_files/71jp+BnLmzL._AC_UY218_.jpg,"Dell Inspiron 15 3520 (2024) Business Laptop (15.6"" FHD Touchscreen IPS, Intel Core i5-1155G7, 16GB RAM, 512GB SSD) Numeric Keypad, Narrow-Bezel, Webcam, Inspiron 3000, Win 11 Home, Carbon Black"
"HP - Pavilion x360 2-in-1 14"" Touch-Screen Laptop - Intel Core i5-8GB Memory - 512GB SSD - Natural Silver - Mode 14-ek0033dx",Price not found,Rating not found,No featured offers available,./Amazon_laptop_files/81BLK5ExrbL._AC_UY218_.jpg,"HP - Pavilion x360 2-in-1 14"" Touch-Screen Laptop - Intel Core i5-8GB Memory - 512GB SSD - Natural Silver - Mode 14-ek0033dx"
"Lenovo ThinkBook 15 Gen 4 Business Laptop (15.6"" IPS FHD Touchscreen, Intel 10-Core i7-1255U, 16GB RAM, 512GB SSD), FHD Webcam, Narrow Bezel, Backlit, Fingerprint, Thunderbolt 4, Win 11 Pro, Grey",$899.98,Rating not found,Past sale not found,./Amazon_laptop_files/71x3GNphKbL._AC_UY218_.jpg,"Lenovo ThinkBook 15 Gen 4 Business Laptop (15.6"" IPS FHD Touchscreen, Intel 10-Core i7-1255U, 16GB RAM, 512GB SSD), FHD Webcam, Narrow Bezel, Backlit, Fingerprint, Thunderbolt 4, Win 11 Pro, Grey"
"HP Business Laptop, 15.6"" HD Touchscreen, Intel Core i3-1115G4 Processor (Up to 4.10 GHz), 16GB RAM, 1TB SSD, 11 Hr Battery Life, Micro-Edge, Anti-Glare Screen, Thin & Portable, Win 11",$422.97,Rating not found,More Buying Choices,./Amazon_laptop_files/81kmD33aJ4L._AC_UY218_.jpg,"HP Business Laptop, 15.6"" HD Touchscreen, Intel Core i3-1115G4 Processor (Up to 4.10 GHz), 16GB RAM, 1TB SSD, 11 Hr Battery Life, Micro-Edge, Anti-Glare Screen, Thin & Portable, Win 11"
"acer Aspire 1 A115-32-C96U Home & Student Slim Laptop (15.6"" FHD, Intel Celeron N4500, 32GB RAM, 1TB SSD, UHD Graphics) 1-Year Office 365, Ethernet, Wi-Fi, Webcam, IST HDMI, Win 11 Home, Silver",$449.98,4.5 out of 5 stars,Past sale not found,./Amazon_laptop_files/71fvVqOKyLL._AC_UY218_.jpg,"acer Aspire 1 A115-32-C96U Home & Student Slim Laptop (15.6"" FHD, Intel Celeron N4500, 32GB RAM, 1TB SSD, UHD Graphics) 1-Year Office 365, Ethernet, Wi-Fi, Webcam, IST HDMI, Win 11 Home, Silver"
"Vera Bradley Cotton Laptop Organizer, Morning Glory",$32.09,Rating not found,List:,./Amazon_laptop_files/615jggn03dL._AC_UY218_.jpg,"Vera Bradley Cotton Laptop Organizer, Morning Glory"
"Satco S49393 Corncob LED HID Light Bulb, Mogul Extended Base, 45W, 35000 Hour Rating, 6210L, Natural Light",$42.53,Rating not found,Past sale not found,./Amazon_laptop_files/71RZl6mFoTL._AC_UY218_.jpg,"Satco S49393 Corncob LED HID Light Bulb, Mogul Extended Base, 45W, 35000 Hour Rating, 6210L, Natural Light"
"Apple 2024 MacBook Air 15-inch Laptop with M3 chip: 8GB Memory, 256GB Storage; Starlight with AppleCare+ (3 Years)","$1,378.00",4.7 out of 5 stars,List:,./Amazon_laptop_files/61IU99MrvIL._AC_UY218_.jpg,"Apple 2024 MacBook Air 15-inch Laptop with M3 chip: 8GB Memory, 256GB Storage; Starlight with AppleCare+ (3 Years)"
